{
  "schema_version": "1.0.0",
  "status": "confirmada",
  "familia_id": "nav4-t2",
  "conceitos": [
    {
      "concept_id": "NAV4-ESCOPO",
      "assunto": "Recorte oficial da T2",
      "dependencias": [],
      "fontes_localizadas": [
        "Orientação T2/2026 e materiais do Drive"
      ],
      "evidencia_prioridade": [
        "Orientação/problemas possíveis e histórico de avaliação"
      ],
      "examinavel": true,
      "presenca": {
        "rapido": true,
        "pra-safar": true,
        "completo": true
      },
      "profundidade": {
        "rapido": "operacional",
        "pra-safar": "examinável",
        "completo": "integrado"
      },
      "justificativa": {
        "rapido": "Incluído por compor o núcleo anunciado ou uma dependência crítica.",
        "pra-safar": "Incluído por ser examinável ou necessário à resolução.",
        "completo": "Incluído para domínio integrado sustentado pelas fontes."
      },
      "exemplos": [],
      "figuras": [],
      "questoes": [
        "NAV4-Q042"
      ],
      "vulnerabilidades": [
        "sinal, nome, tabela ou sequência incorreta"
      ]
    },
    {
      "concept_id": "NAV4-ANB2026",
      "assunto": "Uso obrigatório do Almanaque Náutico 2026",
      "dependencias": [],
      "fontes_localizadas": [
        "Orientação T2/2026 e materiais do Drive"
      ],
      "evidencia_prioridade": [
        "Orientação/problemas possíveis e histórico de avaliação"
      ],
      "examinavel": true,
      "presenca": {
        "rapido": true,
        "pra-safar": true,
        "completo": true
      },
      "profundidade": {
        "rapido": "operacional",
        "pra-safar": "examinável",
        "completo": "integrado"
      },
      "justificativa": {
        "rapido": "Incluído por compor o núcleo anunciado ou uma dependência crítica.",
        "pra-safar": "Incluído por ser examinável ou necessário à resolução.",
        "completo": "Incluído para domínio integrado sustentado pelas fontes."
      },
      "exemplos": [],
      "figuras": [],
      "questoes": [
        "NAV4-Q007",
        "NAV4-Q041",
        "NAV4-Q042",
        "NAV4-Q049",
        "NAV4-Q057",
        "NAV4-Q059"
      ],
      "vulnerabilidades": [
        "sinal, nome, tabela ou sequência incorreta"
      ]
    },
    {
      "concept_id": "NAV4-ALT-CADEIA",
      "assunto": "Cadeia ai→ao→aap→a",
      "dependencias": [],
      "fontes_localizadas": [
        "Apostila p. 139–152; aula 7.0"
      ],
      "evidencia_prioridade": [
        "Orientação/problemas possíveis e histórico de avaliação"
      ],
      "examinavel": true,
      "presenca": {
        "rapido": true,
        "pra-safar": true,
        "completo": true
      },
      "profundidade": {
        "rapido": "operacional",
        "pra-safar": "examinável",
        "completo": "integrado"
      },
      "justificativa": {
        "rapido": "Incluído por compor o núcleo anunciado ou uma dependência crítica.",
        "pra-safar": "Incluído por ser examinável ou necessário à resolução.",
        "completo": "Incluído para domínio integrado sustentado pelas fontes."
      },
      "exemplos": [],
      "figuras": [
        "NAV4-FIG-ALT-001"
      ],
      "questoes": [
        "NAV4-Q001",
        "NAV4-Q008",
        "NAV4-Q025",
        "NAV4-Q047"
      ],
      "vulnerabilidades": [
        "sinal, nome, tabela ou sequência incorreta"
      ]
    },
    {
      "concept_id": "NAV4-ALT-DIP",
      "assunto": "Depressão aparente",
      "dependencias": [
        "NAV4-ALT-CADEIA"
      ],
      "fontes_localizadas": [
        "Apostila p. 139–152; aula 7.0"
      ],
      "evidencia_prioridade": [
        "Orientação/problemas possíveis e histórico de avaliação"
      ],
      "examinavel": true,
      "presenca": {
        "rapido": true,
        "pra-safar": true,
        "completo": true
      },
      "profundidade": {
        "rapido": "operacional",
        "pra-safar": "examinável",
        "completo": "integrado"
      },
      "justificativa": {
        "rapido": "Incluído por compor o núcleo anunciado ou uma dependência crítica.",
        "pra-safar": "Incluído por ser examinável ou necessário à resolução.",
        "completo": "Incluído para domínio integrado sustentado pelas fontes."
      },
      "exemplos": [],
      "figuras": [
        "NAV4-FIG-ALT-001"
      ],
      "questoes": [
        "NAV4-Q002",
        "NAV4-Q006",
        "NAV4-Q008"
      ],
      "vulnerabilidades": [
        "sinal, nome, tabela ou sequência incorreta"
      ]
    },
    {
      "concept_id": "NAV4-ALT-AR",
      "assunto": "Refração astronômica",
      "dependencias": [
        "NAV4-ALT-CADEIA"
      ],
      "fontes_localizadas": [
        "Apostila p. 139–152; aula 7.0"
      ],
      "evidencia_prioridade": [
        "Orientação/problemas possíveis e histórico de avaliação"
      ],
      "examinavel": true,
      "presenca": {
        "rapido": true,
        "pra-safar": true,
        "completo": true
      },
      "profundidade": {
        "rapido": "operacional",
        "pra-safar": "examinável",
        "completo": "integrado"
      },
      "justificativa": {
        "rapido": "Incluído por compor o núcleo anunciado ou uma dependência crítica.",
        "pra-safar": "Incluído por ser examinável ou necessário à resolução.",
        "completo": "Incluído para domínio integrado sustentado pelas fontes."
      },
      "exemplos": [],
      "figuras": [
        "NAV4-FIG-ALT-001"
      ],
      "questoes": [
        "NAV4-Q003",
        "NAV4-Q006",
        "NAV4-Q047",
        "NAV4-Q048"
      ],
      "vulnerabilidades": [
        "sinal, nome, tabela ou sequência incorreta"
      ]
    },
    {
      "concept_id": "NAV4-ALT-SD",
      "assunto": "Semidiâmetro e limbos",
      "dependencias": [
        "NAV4-ALT-CADEIA"
      ],
      "fontes_localizadas": [
        "Apostila p. 139–152; aula 7.0"
      ],
      "evidencia_prioridade": [
        "Orientação/problemas possíveis e histórico de avaliação"
      ],
      "examinavel": true,
      "presenca": {
        "rapido": true,
        "pra-safar": true,
        "completo": true
      },
      "profundidade": {
        "rapido": "operacional",
        "pra-safar": "examinável",
        "completo": "integrado"
      },
      "justificativa": {
        "rapido": "Incluído por compor o núcleo anunciado ou uma dependência crítica.",
        "pra-safar": "Incluído por ser examinável ou necessário à resolução.",
        "completo": "Incluído para domínio integrado sustentado pelas fontes."
      },
      "exemplos": [],
      "figuras": [
        "NAV4-FIG-ALT-001"
      ],
      "questoes": [
        "NAV4-Q004",
        "NAV4-Q006",
        "NAV4-Q049"
      ],
      "vulnerabilidades": [
        "sinal, nome, tabela ou sequência incorreta"
      ]
    },
    {
      "concept_id": "NAV4-ALT-PA",
      "assunto": "Paralaxe",
      "dependencias": [
        "NAV4-ALT-CADEIA"
      ],
      "fontes_localizadas": [
        "Apostila p. 139–152; aula 7.0"
      ],
      "evidencia_prioridade": [
        "Orientação/problemas possíveis e histórico de avaliação"
      ],
      "examinavel": true,
      "presenca": {
        "rapido": true,
        "pra-safar": true,
        "completo": true
      },
      "profundidade": {
        "rapido": "operacional",
        "pra-safar": "examinável",
        "completo": "integrado"
      },
      "justificativa": {
        "rapido": "Incluído por compor o núcleo anunciado ou uma dependência crítica.",
        "pra-safar": "Incluído por ser examinável ou necessário à resolução.",
        "completo": "Incluído para domínio integrado sustentado pelas fontes."
      },
      "exemplos": [],
      "figuras": [
        "NAV4-FIG-ALT-001"
      ],
      "questoes": [
        "NAV4-Q005",
        "NAV4-Q006"
      ],
      "vulnerabilidades": [
        "sinal, nome, tabela ou sequência incorreta"
      ]
    },
    {
      "concept_id": "NAV4-ALT-LUA",
      "assunto": "Correções específicas da Lua",
      "dependencias": [
        "NAV4-ALT-AR",
        "NAV4-ALT-SD",
        "NAV4-ALT-PA"
      ],
      "fontes_localizadas": [
        "Apostila p. 139–152; aula 7.0"
      ],
      "evidencia_prioridade": [
        "Orientação/problemas possíveis e histórico de avaliação"
      ],
      "examinavel": true,
      "presenca": {
        "rapido": true,
        "pra-safar": true,
        "completo": true
      },
      "profundidade": {
        "rapido": "operacional",
        "pra-safar": "examinável",
        "completo": "integrado"
      },
      "justificativa": {
        "rapido": "Incluído por compor o núcleo anunciado ou uma dependência crítica.",
        "pra-safar": "Incluído por ser examinável ou necessário à resolução.",
        "completo": "Incluído para domínio integrado sustentado pelas fontes."
      },
      "exemplos": [],
      "figuras": [
        "NAV4-FIG-ALT-001"
      ],
      "questoes": [
        "NAV4-Q007",
        "NAV4-Q049"
      ],
      "vulnerabilidades": [
        "sinal, nome, tabela ou sequência incorreta"
      ]
    },
    {
      "concept_id": "NAV4-ALT-FISICA",
      "assunto": "Fundamento físico das correções",
      "dependencias": [
        "NAV4-ALT-CADEIA"
      ],
      "fontes_localizadas": [
        "Apostila p. 139–152; aula 7.0"
      ],
      "evidencia_prioridade": [
        "Aprofundamento sustentado pela fonte"
      ],
      "examinavel": false,
      "presenca": {
        "rapido": true,
        "pra-safar": true,
        "completo": true
      },
      "profundidade": {
        "rapido": "operacional",
        "pra-safar": "examinável",
        "completo": "integrado"
      },
      "justificativa": {
        "rapido": "Incluído no nível necessário para prever sinais e eliminar pegadinhas.",
        "pra-safar": "Incluído porque causa, direção e extremos sustentam as decisões examináveis.",